Institute,Keywords,Project,Geographic Reach,Funding Amount,3 year savings,Summary,Category,Stage,Model,url,Unique ID
Fund for Public Health in New York,"Health Care Innovation Awards, HCIA, New York, NY, Medicaid, mental illness, psychosis, peer health navigators, nurse practitioners, primary care, hospital admissions, ER, community care, behavioral health, Fund for Public Health in New York, CMS Region 2",Parachute NYC: an alternative approach to mental health treatment and crisis services,New York,"17,608,085.00","51,696,138.00","The Fund for Public Health in New York, Inc., in partnership with the New York City Department of Health and Mental Hygiene’s Division of Mental Hygiene, received an award to implement Parachute NYC, a citywide approach to provide a “soft-landing” for individuals experiencing psychiatric crisis. This new program offers community centered options that focus on recovery, hope — and a healthy future. Parachute NYC uses mobile treatment teams, crisis respite centers, and a peer operated Support Line to provide early engagement (including a dedicated program for first episode psychosis), continuity of care and combined peer and non-peer community service, thus shifting the focus of care from crisis intervention to long-term, community-integrated treatment with access to primary care, improving crisis management and reducing emergency room visits and hospital admissions. Parachute NYC serves communities in Manhattan, Brooklyn, Bronx, and Queens.",Initiatives to Accelerate the Development and Testing of New Payment and Service Delivery Models,Ongoing,Health Care Innovation Awards,http://innovation.cms.gov/initiatives/participant/Health-Care-Innovation-Awards/Fund-For-Public-Health-In-New-York.html,92
State of Colorado,"State Innovation Models Initiative: Model Pre-Testing Awards, Colorado, CO, State Health Care Innovation Plan, Statewide Health Innovations Fostering Transformation (SHIFT), clinical health care, behavioral health care, care integration, high-risk, high-cost, chronic disease, mental health, substance abuse, preventive strategies, CMS Region 8",One of three states further developing models for multi-payer payment reform and health care delivery system transformation. ,Colorado,"2,000,422.00",,,Initiatives to Accelerate the Development and Testing of New Payment and Service Delivery Models,Participants Announced,State Innovation Models Initiative: Model Pre-Test Awards,http://innovation.cms.gov/initiatives/participant/State-Innovations-Model-Pre-Testing/Colorado.html,89
State of Washington,"State Innovation Models Initiative: Model Pre-Testing Awards, Washington, WA, maternal care, infant care, chronic conditions, multi-payer, integrated care, virtual Accountable Care Organizations (ACOs), primary care providers, specialists, care integration, quality improvement, quality collaboratives, transformative design model, Regional Collaborative community health, behavioral health, evidence-based strategies, CMS Region 10",One of three states further developing models for multi-payer payment reform and health care delivery system transformation. ,Washington,"999,975.00",,,Initiatives to Accelerate the Development and Testing of New Payment and Service Delivery Models,Participants Announced,State Innovation Models Initiative: Model Pre-Test Awards,http://innovation.cms.gov/initiatives/participant/State-Innovations-Model-Pre-Testing/Washington.html,90
Women & Infants Hospital of Rhode Island,"Health Care Innovation Awards, HCIA, Rhode Island, RI, infants, children, ER, hospitalizations, neonatal, mothers, Women & Infants Hospital of Rhode Island, CMS Region 1","Partnering with parents, the medical home and community provider to improve transition services for high-risk preterm infants in Rhode Island",Rhode Island,"3,261,494.00","3,700,000.00","Women and Infants Hospital of Rhode Island received an award to improve services for approximately 2400 families in Rhode Island who have pre-term or high-risk full term babies with a Neonatal Intensive Care Unit (NICU) admission of 5 or more days. The Partnering with Parents intervention has hired, trained and deployed Early-Moderate Preterm, Late Preterm, and high-risk full term family care teams to offer education and support to parents during the transition from the NICU to home, and monitor infants’ growth and development. The program also supports primary care providers who help provide care for this at-risk population and has partnered with home nursing agencies throughout the state to coordinate infants’ care post discharge. The results are expected to be reduced emergency room visits, fewer hospital readmissions, and decreased neonatal morbidity. This approach is expected to lower costs while improving health and health care for pre-term and high-risk full term babies in Rhode Island with estimated savings of approximately $3.7 million. Over the three-year period, Women & Infants Hospital of Rhode Island’s program will train an estimated 120 health care workers and early intervention providers, while creating an estimated 12 new jobs. The Partnering with Parents program is training and deploying these workers as part of Family Care Teams to offer education and support and monitor infants’ growth and development.",Initiatives to Accelerate the Development and Testing of New Payment and Service Delivery Models,Ongoing,Health Care Innovation Awards,http://innovation.cms.gov/initiatives/participant/Health-Care-Innovation-Awards/Women-and-Infants-Hospital-Of-Rhode-Island.html,93
The Research Institute at Nationwide Children's Hospital,"Health Care Innovation Awards, HCIA, Ohio, OH, children, pediatrics, Medicaid, home-based care, rural, urban,The Research Institute at Nationwide Children's Hospital, CMS Region 5",Partners for Kids Expansion,Ohio,"13,160,092.00","51,714,650.00","The Research Institute at Nationwide Children's Hospital, in partnership with Akron Children’s Hospital and its integrated physician group, received an award to expand its Partners for Kids (PFK) program in Ohio, serving over 492,000 Medicaid children enrollees and 25,000 children with disabilities (the most costly pediatric population). PFK will enhance provider incentives and improve access for high risk rural and urban underserved populations through comprehensive medical home-based services and the rapid deployment of an expanded health care workforce focusing on behavioral health, complex care, and high risk pregnancy.",Initiatives to Accelerate the Development and Testing of New Payment and Service Delivery Models,Ongoing,Health Care Innovation Awards,http://innovation.cms.gov/initiatives/participant/Health-Care-Innovation-Awards/The-Research-Institute-At-Nationwide-Children-Hospital.html,94
Joslin Diabetes Center Inc.,"Health Care Innovation Awards, HCIA, District of Columbia, DC, New Mexico, NM, Pennsylvania, PA, diabetes, Medicare, Medicaid, diabetes, underserved, hospitalizations, community health, health educators, Joslin Diabetes Center Inc., CMS Region 3, CMS Region 6",Pathways to better health through a new health care workforce and community,"District of Columbia, New Mexico, Pennsylvania","4,967,276.00","7,400,000.00","Joslin Diabetes Center, Inc., received an award to expand a successful program for diabetes education, field testing, and risk assessment.  Their “On the Road” program will send trained community health workers into community settings to help approximately 5100 unique participants (most of whom are Medicare/Medicaid beneficiaries and /or low income/uninsured) understand their risks and improve health habits for the prevention and management of diabetes.  The program will target at risk and underserved populations in New Mexico, Pennsylvania, and Washington, D.C., helping to prevent the development and progression of diabetes and reducing overall costs, avoidable hospitalizations, and the development of chronic co-morbidities with estimated savings of approximately $7.4 million.  Over the three-year period, Joslin Diabetes Center’s program will train an estimated 27 workers, while creating an estimated 9 new jobs.  These workers will include community health advocates and health education instructors who will educate patients in managing diabetes and pre-diabetes with the goal of re-engaging them into the healthcare system.",Initiatives to Accelerate the Development and Testing of New Payment and Service Delivery Models,Ongoing,Health Care Innovation Awards,http://innovation.cms.gov/initiatives/participant/Health-Care-Innovation-Awards/Joslin-Diabetes-Center-Inc.html,95
"HealthLinkNow, Inc.","Health Care Innovation Awards, HCIA, California, CA, Montana, MT, Washington, WA, Wyoming, WY, patient centered medical home, mental health, substance abuse, psychiatrists, videoconferencing, remote monitoring, mental health, hospital admissions, ER, therapists, HealthLinkNow Inc., CMS Region 10, CMS Region 8",Patient-centered medical home for mental health services in Wyoming and Montana,"California, Montana, Washington, Wyoming","7,718,636.00","8,100,000.00","HealthLinkNow Inc, partnering with a number of local provider groups and health networks in Montana and Wyoming, is received an award to provide a Patient Centered Medical Home Program (PCMH) with mental health and substance abuse services in areas where geography and lack of psychiatrists and psychologists complicate access. This model will offer videoconferencing between local patients and HealthLinkNow psychiatrists; instant messaging, email, and telephone calls via HealthLinkNow between providers and patients; and a HealthLinkNow IT platform that allows billing, e-prescribing, and practice management. The program will improve access to psychiatric consultations, therapy, and long-term mental health case management. Lower costs through reduced hospital admissions and emergency room visits are anticipated. Over a three-year period, HealthLinkNow will hire 24 health care providers, including both psychiatrists and therapists.",Initiatives to Accelerate the Development and Testing of New Payment and Service Delivery Models,Ongoing,Health Care Innovation Awards,http://innovation.cms.gov/initiatives/participant/Health-Care-Innovation-Awards/Healthlinknow-Inc.html,96
Mayo Clinic,"Health Care Innovation Awards, HCIA, Massachusetts, MA, Minnesota, MN, New York, NY, Oklahoma, OK, Medicare, Medicaid, ICU, data, HIT, critical care, Mayo Clinic, CMS Region 1, CMS Region 5, CMS Region 2, CMS Region 6",Patient-centric electronic environment for improving acute care performance,"Massachusetts, Minnesota, New York, Oklahoma","16,035,264.00","81,345,987.00","The Mayo Clinic received an award to improve critical care performance for Medicare and Medicaid beneficiaries in intensive care units (ICUs). The goal of this project is to develop and test a novel acute care interface with built-in-tools for error prevention, practice surveillance, decision support and reporting (ProCCESs AWARE - Patient Centered Cloud-based Electronic System: Ambient Warning and Response Evaluation). In preliminary studies, these novel informatics support builds on advanced understanding of cognitive and organizational ergonomics, have significantly decreased cognitive load of bedside providers and reduced medical errors. Using a cloud-based technology, AWARE will be uniformly available on either mobile or fixed computing devices and applied in a standardized manner in medical and surgical ICUs of geographically diverse acute care hospitals predominantly serving Medicare and Medicaid patients. The impact of ProCCESs AWARE on processes of care and outcomes in study ICUs will be evaluated using standardized step-wedge cluster randomized study design expected to enroll more than 10,000 critically ill patients during the three year study period. Over a three-year period, the Mayo Clinic will train 1440 existing ICU caregivers in four diverse hospital systems to use new health information technologies effectively in managing ICU patient care.",Initiatives to Accelerate the Development and Testing of New Payment and Service Delivery Models,Ongoing,Health Care Innovation Awards,http://innovation.cms.gov/initiatives/participant/Health-Care-Innovation-Awards/Mayo-Clinic.html,97
Asian Americans for Community Involvement,"Health Care Innovation Awards, HCIA, California, CA, community, patient navigators, disease screening, medication adherence, case workers, non-clinical, nurse advisors, clinicians, customer service manager, Asian Americans for Community Involvement, CMS Region 9",Patient Navigation Center,California,"2,684,545.00","3,373,602.00","Asian Americans for Community Involvement (AACI), in partnership with the Career Ladders Project and local community colleges, received an award to train Asian and Hispanic youth as non-clinical health workers for a Patient Navigation Center (PNC). Serving low-income Asian and Hispanic families in Santa Clara County, PNC will provide enabling services, including translation, appointment scheduling, referrals, and application help for social services, as well as after-hours and self-care assistance. Patient navigation will lead to improved access to care, better disease screening, decreased diagnosis time, better medication adherence, a reduction in emergency room visits, and reduced anxiety for patients. Over a three-year period, Asian Americans for Community Involvement will re-train its current staff of nurses, supervisors, and on-call clinicians and create an estimated 29 jobs. The new workers will include patient navigators, nurse and clinician advisors, and a workforce manager.",Initiatives to Accelerate the Development and Testing of New Payment and Service Delivery Models,Ongoing,Health Care Innovation Awards,http://innovation.cms.gov/initiatives/participant/Health-Care-Innovation-Awards/Asian-Americans-For-Community-Involvement.html,98
University of Hawaii at Hilo,"Health Care Innovation Awards, HCIA, Hawaii, HI, rural, elderly, medication adherence, pharmacists, information technology, care transitions, hospitalizations, ER, project coordinator, project manager, University of Hawaii at Hilo, CMS Region 9","Pharm2Pharm, a formal hospital pharmacist to community pharmacist collaboration",Hawaii,"14,346,043.00","27,114,939.00","The University of Hawaii at Hilo has received an award to implement Pharm2Pharm, a care transition and coordination model designed to improve patient safety and reduce medication-related hospitalizations and emergency room visits. This formal hospital pharmacist-to-community pharmacist collaboration (called “pharmacist-to-pharmacist” or “Pharm2Pharm”) closes gaps in care as patients transition from hospital to community settings.  This model has been implemented in all three rural counties of Hawaii, where physician shortages are particularly severe. The result will be better care transitions, a reduction in adverse events, improved medication adherence, and better-informed, more patient-centered decisions about medication therapies, leading to reduced hospitalizations, readmissions, and emergency room visits and better health care and health for the patients served.",Initiatives to Accelerate the Development and Testing of New Payment and Service Delivery Models,Ongoing,Health Care Innovation Awards,http://innovation.cms.gov/initiatives/participant/Health-Care-Innovation-Awards/University-Of-Hawaii-At-Hilo.html,99
Palliative Care Consultants of Santa Barbara,"Health Care Innovation Awards, HCIA, California, CA, elderly, home care, hospitalizations, ER, project manager, rapid response, Palliative Care Consultants of Santa Barbara, CMS Region 9",Physicians quick response service,California,"4,254,615.00","3,229,481.00","Palliative Care Consultants of Santa Barbara received an award to provide health care services to the frail elderly in times of crisis. The name of their program is “DASH,” Doctors Assisting Seniors at Home. The intervention will create new options for frail elderly to access rapid assessment and treatment in their homes through a Rapid Response Team (RRT) dispatched to the homes of seniors who have fallen ill. This approach will reduce delays in care for the frail elderly and create lower exposure to hospitalization-related risks. Specially trained first responders will arrive within one hour to initiate the in-home assessment and triage process. The focus of this initiative is to provide active treatment to frail elderly patients in their home. The goal is to reduce emergency room visits and avoidable hospital admissions, increase patient satisfaction, and provide better, more immediate care through a system that is patient-centered and timely. Over a three-year period, Palliative Care Consultants of Santa Barbara’s program will train an estimated 32 workers and create an estimated 20 jobs. New workers will include physicians, first responders, a project manager, enrollment specialists, and an administrative assistant/communication specialist.",Initiatives to Accelerate the Development and Testing of New Payment and Service Delivery Models,Ongoing,Health Care Innovation Awards,http://innovation.cms.gov/initiatives/participant/Health-Care-Innovation-Awards/Palliative-Care-Consultants-Of-Santa-Barbara.html,100
Beth Israel Deaconess,"Health Care Innovation Awards, HCIA, Massachusetts, MA, congestive heart failure, acute myocardial infarctions, pneumonia, preventable readmissions, readmissions, Medicare, Medicaid, patients transitions, evidence-based best practices, care transition specialists, Beth Israel Deaconess, CMS Region 1",Preventing avoidable re-hospitalizations: Post-Acute Care Transition Program (PACT),Massachusetts,"4,937,191.00","12,900,000.00","Beth Israel Deaconess Medical Center (BIDMC) of Boston, Massachusetts, received an award to improve care transitions and reduce hospital readmissions for Medicare beneficiaries and beneficiaries dually eligible for Medicare and Medicaid. By integrating care, improving patients’ transitions between locations of care, and focusing on a battery of evidence-based best practices, this model is expected to prevent complications and reduce preventable readmissions, resulting in better quality health care at lower cost in the urban Boston area with estimated savings of almost $13 million over 3 years.",Initiatives to Accelerate the Development and Testing of New Payment and Service Delivery Models,Ongoing,Health Care Innovation Awards,http://innovation.cms.gov/initiatives/participant/Health-Care-Innovation-Awards/Beth-Israel-Deaconess.html,101
St. Francis Healthcare Foundation of Hawaii,"Health Care Innovation Awards, HCIA, Hawaii, HI, hospitalizations, telehealth, home-based care, care management, medication adherence, nurses, project director, St. Francis Healthcare Foundation of Hawaii, CMS Region 9",Preventing hospitalizations in very high-risk patients,Hawaii,"5,299,706.00","10,393,944.00","Home Outreach Program & E-health (H.O.P.E.), supported by St. Francis Healthcare Foundation of Hawaii, received a Health Care Innovation Award from the Center of Medicaid and Medicare Services in June 2012. This initiative addresses healthcare costs associated with both hospitalizations and <30-day readmissions, with the goal of improving patient outcomes and reducing healthcare spending. The program consists of two high-risk groups: outpatients with complex health care needs identified by an algorithm and patients discharged from hospitals with the diagnosis of congestive heart failure, pneumonia, or acute myocardial infarction.  In the first group, Prevention of 1-Year Hospitalization, the emphasis will be on changing behavior, using home telehealth equipment with nurse clinician oversight as a reinforcing tool for patients to experience the impact of improved adherence with medications and other treatments.  In the second group, Prevent <30-Day Readmission, the focus will be on the transition to home of potentially unstable patients with the emphasis on the daily clinical measurements outlined in their physician’s plan of care and supported by nurse clinician oversight.  Data will be collected regularly to evaluate patient outcomes, patient and workforce satisfaction, and cost effectiveness of the program. The goal is to reduce preventable hospitalizations and readmissions by 40% as compared to a control group and to improve patients' health and quality of life.",Initiatives to Accelerate the Development and Testing of New Payment and Service Delivery Models,Ongoing,Health Care Innovation Awards,http://innovation.cms.gov/initiatives/participant/Health-Care-Innovation-Awards/St-Francis-Healthcare-Foundation-Of-Hawaii.html,102
Family Service Agency of San Francisco,"Health Care Innovation Awards, HCIA, California, CA, psychosis, schizophrenia, low income, Medicare, evidence-based treatments, medication management, social workers, nurse practitioners, vocational counselors, Family Service Agency of San Francisco, CMS Region 9",Prevention and Recovery in Early Psychosis (PREP),California,"4,703,817.00","4,235,801.00","Family Service Agency of San Francisco expanded its Prevention and Recovery in Early Psychosis (PREP) to two low-income, largely Latino counties in Central and Northern California, San Joaquin (Stockton) and Monterey (Salinas). Schizophrenia is estimated to account for 2.5 to 3 percent of United States health care expenditures. Without an intervention like PREP, as many as 90 percent of the patients served would be Supplemental Security Income/Medicare recipients (up from 30 percent now) by the time they reached their 30s. Through evidence-based treatments, medication management, and care management, PREP aims to prevent the onset of full psychosis, and in cases in which full psychosis has already occurred, seeks to fully remit the disease and rehabilitate the cognitive functions it has damaged. Family Service Agency of San Francisco has trained over 20 health care providers to use their PREP intervention, while creating 19 jobs for social workers, Nurse Practitioners, vocational counselors, and peer and family aides.",Initiatives to Accelerate the Development and Testing of New Payment and Service Delivery Models,Ongoing,Health Care Innovation Awards,http://innovation.cms.gov/initiatives/participant/Health-Care-Innovation-Awards/Family-Service-Agency-Of-San-Francisco.html,103
Feinstein Institute for Medical Research,"Health Care Innovation Awards, HCIA, Florida, FL, Indiana, IN, Michigan, MI, Missouri, MO, New Hampshire, NH, New Mexico, NM, New York, NY, Oregon, OR, schizophrenia, care managers, physicians, nurse practitioners, pharmacologic management, cognitive behavior therapy, web-based monitoring, home-based monitoring, hospitalizations, physician assistants, mental health, Feinstein Institute for Medical Research, CMS Region 4, CMS Region 5, CMS Region 7, CMS Region 1, CMS Region 2, CMS Region 10",Using care managers and technology to improve the care of patients with schizophrenia,"Florida, Indiana, Michigan, Missouri, New Hampshire, New Mexico, New York, Oregon","9,380,855.00","10,080,000.00","The Feinstein Institute for Medical Research received an award to develop a workforce that is capable of delivering effective treatments, using newly available technologies, to at-risk, high-cost patients with schizophrenia. The intervention will test the use of care managers, physicians, and nurse practitioners trained to use new technology as part of the treatment regime for patients recently discharged from the hospital at community treatment centers in eight states. These trained providers will educate patients and their caregivers about pharmacologic management, cognitive behavior therapy, and web-based/home-based monitoring tools for their conditions. This intervention is expected to improve patients’ quality of life and lower cost by reducing hospitalizations. Over a three-year period, the Feinstein Institute for Medical Research will retrain nurse practitioners, physician assistants, physicians, and case managers to use newly available mental health protocols and health technology resources.",Initiatives to Accelerate the Development and Testing of New Payment and Service Delivery Models,Ongoing,Health Care Innovation Awards,http://innovation.cms.gov/initiatives/participant/Health-Care-Innovation-Awards/Feinstein-Institute-For-Medical-Research.html,130
