Institute,Keywords,Project,Geographic Reach,Funding Amount,3 year savings,Summary,Category,Stage,Model,url,Unique ID
Cooper University Hospital,"Health Care Innovation Awards, HCIA, New Jersey, NJ, ER, care management, care transition, hospital admissions, hospital readmissions, primary health care, community health workers, care coordination, complex health conditions, Cooper University Hospital, CMS Region 2",N/A,New Jersey,"2,788,457.00","6,200,000.00","Cooper University Hospital in conjunction with the Camden Coalition of Healthcare Providers, serving Camden, New Jersey, received an award to better serve approximately 600 Camden residents with complex medical needs who have relied on emergency rooms and hospital admissions for care. The intervention will use nurse led interdisciplinary outreach teams to work with enrolled participants to reduce hospital readmissions and improve their access to primary health care. This approach is expected to result in better health care outcomes and lower cost with estimated savings of over $6 million. Over the three-year period, Cooper University Hospital’s program will train an estimated 22 health care workers, while creating an estimated 16 new jobs. These workers will include non-clinical staff, like AmeriCorps volunteers and community health workers, who will serve as part of the multidisciplinary teams to support care coordination activities.",Initiatives to Accelerate the Development and Testing of New Payment and Service Delivery Models,Ongoing,Health Care Innovation Awards,http://innovation.cms.gov/initiatives/participant/Health-Care-Innovation-Awards/Cooper-University-Hospital.html,64
Mineral Regional Health Center,"Health Care Innovation Awards, HCIA, Montana, MT, rural health, critical access, Medicare, Medicaid, CHIP, health improvement specialists, program director, chief medical officer, Mineral Regional Health Center, CMS Region 8",Frontier Medicine Better Health Partnership,Montana,"10,499,889.00","31,992,800.00","Mineral Regional Health Center, partnering with Montana’s frontier and rural health care communities, Appalachian Osteopathic Postgraduate Training Institute Consortium (A-OPTIC), and iVantage Health Analytics, received an award to develop and implement a Frontier and Rural Performance Network and learning collaborative that will standardize operations and efficiencies across all of the state’s hospitals, including tertiary care centers and critical access hospitals. By the third year of the project, there will be a total of 25 critical access included in the network, serving over 52,000 beneficiaries of Medicare, Medicaid, and the Children’s Health Insurance Program. Training will be provided to all participating sites in this network. Support for sites will include health improvement specialists, technology specialists, and data analysis. The goal is to standardize improvement efforts and operational processes based upon best practices, resulting in better health care outcomes and efficiencies. Over a three-year period, the Mineral Regional Health Center will hire 35 health care workers, including a program director, associate director, chief financial officer, chief clinical officer, LEAN/community collaborative specialist, workforce development officer, team coordinator, and a human resources director as well as a staff of health improvement specialists, technology specialists, health analysts, and administrative support workers.",Initiatives to Accelerate the Development and Testing of New Payment and Service Delivery Models,Ongoing,Health Care Innovation Awards,http://innovation.cms.gov/initiatives/participant/Health-Care-Innovation-Awards/Mineral-Regional-Health-Center.html,38
Mount Sinai School of Medicine,"Health Care Innovation Awards, HCIA, Illinois, IL, New Jersey, NJ, New York, NY, geriatric, ER, hospitalizations, evidence-based treatments, nurse practitioners, physician assistants, pharmacists, project, care managers, research assistants, data analysts, Mount Sinai School of Medicine, CMS Region 5, CMS Region 2, CMS Region 9","Geriatric emergency department innovations in care through workforce, informatics, and structural enhancements (GEDI WISE)","Illinois, New Jersey, New York","12,728,753.00","40,124,805.00","The Icahn School of Medicine at Mount Sinai received an award to implement a new model of geriatric emergency care in three large, urban hospitals: The Mount Sinai Medical Center in New York City, St. Joseph’s Regional Medical Center in Paterson, NJ, and Northwestern Memorial Hospital in Chicago, IL.  Geriatric Emergency Department Innovations in care through Workforce, Informatics and Structural Enhancements (GEDI WISE) is a multidisciplinary collaboration that has embraced a new care paradigm, the geriatric emergency department, which has transformed both the physical environment and processes of care in these three emergency departments (ED).  GEDI WISE uses evidence-based geriatric clinical protocols, informatics support for patient monitoring and clinical decision-making, and structural enhancements to improve patient safety and satisfaction while decreasing hospitalizations, return ED visits, unnecessary diagnostic and therapeutic services, medication errors, and adverse events, such as falls and avoidable complications. Over a three-year period, GEDI WISE will train more than 400 current health care workers and create 22 new jobs including nurses, nurse practitioners,  pharmacists, physical therapists, project coordinators, data analysts and geriatric transitional care managers.",Initiatives to Accelerate the Development and Testing of New Payment and Service Delivery Models,Ongoing,Health Care Innovation Awards,http://innovation.cms.gov/initiatives/participant/Health-Care-Innovation-Awards/Mount-Sinai-School-Of-Medicine.html,39
State of Pennsylvania,"State Innovation Models Initiative: Model Design Awards, Pennsylvania, PA, public payer, private payer, care transitions, telemedicine, care management, population health, community-based care teams, infrastructure, health information technology, telemedicine, rural, CMS Region 3",One of sixteen states developing models for multi-payer payment and health care delivery system transformation.,Pennsylvania,"1,560,135.00",,,Initiatives to Accelerate the Development and Testing of New Payment and Service Delivery Models,Participants Announced,State Innovation Models Initiative: Model Design Awards Round One,http://innovation.cms.gov/initiatives/participant/State-Innovations-Model-Design/Pennsylvania.html,72
Lifelong Medical Care,"Health Care Innovation Awards, HCIA, California, CA, Medicare, Medicaid, ER, hospitalizations, self management, nurses, health coaches, low-income,Lifelong Medical Care, CMS Region 9",Health Care Innovation Challenge: LifeLong complex care initiative to achieve the Triple Aim,California,"1,109,231.00","1,100,000.00","The LifeLong Complex Care Initiative merges the strengths of a community health center, LifeLong Medical Care, and an independent living center, Center for Independent Living, to provide coordinated, interdisciplinary team care for adults with disabilities who are at high-risk of poor health outcomes and avoidable utilization of high-cost emergency room and inpatient care. The project targets the 20% highest risk patients among a population of 3250 seniors and other adults with disabilities who are Medicaid and dual Medicare/Medicaid beneficiaries living in Alameda County, California and are members of the Alameda Alliance for Health. By the end of the three-year demonstration, the collaboration seeks to improve health outcomes and utilization patterns such that consumers are healthier, more satisfied with their care, and less likely to utilize high-cost services, with a goal of approximately $1 million in cost savings. The intervention trains adults with disabilities as peer coaches, to support consumers to identify and work towards self-directed health goals, such as healthy lifestyle modifications, disease self-management, and increased independence. The peer coaches are partnered with RN care managers, who facilitate integrated care and provide practical services including health education, medication reconciliation, and self-management support. ",Initiatives to Accelerate the Development and Testing of New Payment and Service Delivery Models,Ongoing,Health Care Innovation Awards,http://innovation.cms.gov/initiatives/participant/Health-Care-Innovation-Awards/Lifelong-Medical-Care.html,40
Carilion New River Valley Medical Center,"Health Care Innovation Awards, HCIA, Virginia, VA, West Virginia, WV, medication therapy management, Medicare, Medicaid, rural hospitals, primary care, pharmacists, chronic disease management, care coordination, medication adherence, reduced hospitalizations, ER, Carilion New River Valley Medical Center, CMS Region 3",Improving health for at-risk rural patients (IHARP) in 23 southwest Virginia counties through a collaborative pharmacist practice model,"Virginia, West Virginia","4,162,618.00","4,308,295.00","Carilion New River Valley Medical Center, in partnership with Virginia Commonwealth University School of Pharmacy, Aetna Healthcare and select community pharmacies, received an award to improve medication therapy management for Medicare and Medicaid beneficiaries and other patients in 23 underserved, rural counties in southwest Virginia. Their care delivery model, involving six rural and one urban hospitals and 20 primary care practices, trains pharmacists in transformative care and chronic disease management protocols. Through care coordination and shared access to electronic medical records, the project enables pharmacists to participate in improving medication adherence and management, resulting in better health, reduced hospitalizations and emergency room visits, and fewer adverse drug events for patients with multiple chronic diseases.",Initiatives to Accelerate the Development and Testing of New Payment and Service Delivery Models,Ongoing,Health Care Innovation Awards,http://innovation.cms.gov/initiatives/participant/Health-Care-Innovation-Awards/Carilion-New-River-Valley-Medical-Center.html,43
"Eau Claire Cooperative Health Centers, Inc.","Health Care Innovation Awards, HCIA, South Carolina, SC, low income, underserved, nurse practitioners, registered nurses, community health workers, federally qualified health center, home visits, ER, chronic conditions, peer health workers, community organizer, Eau Claire Cooperative Health Centers Inc., CMS Region 4","Healthy Columbia: recruiting, training, organizing, deploying, and supporting community health teams in low income area of Columbia, South Carolina",South Carolina,"2,330,000.00","14,817,600.00","Eau Claire Cooperative Health Centers, Inc., in partnership with the Select Health and BlueChoice Medicaid Managed Care Organizations, is receiving an award for a project aimed at improving health outcomes for populations in underserved, low-income areas of Columbia, South Carolina. Eau Claire will use health care teams of nurse practitioners, registered nurses, and community health workers affiliated with a Federally Qualified Health Center to provide patient education, home visits, and care coordination, leading to reduced use of high cost health care services, including emergency room visits and hospitalizations, improved self-management for patients with chronic conditions, a decrease in low birth weight infant care, and improved health outcomes in general. Payers have agreed to reimburse a portion of cost savings. Over a three-year period, Eau Claire Cooperative Health Centers will create an estimated 22 health care-related jobs, including positions for peer health workers, registered nurses, Nurse Practitioners, and a project director.",Initiatives to Accelerate the Development and Testing of New Payment and Service Delivery Models,Ongoing,Health Care Innovation Awards,http://innovation.cms.gov/initiatives/participant/Health-Care-Innovation-Awards/Eau-Claire-Cooperative-Health-Centers-Inc.html,41
South Carolina Research Foundation,"Health Care Innovation Awards, HCIA, South Carolina, SC, home-based care, care coordination, chronic disease management, nurses, medication adherence, disease management, hospitalizations, ER, program manager, South Carolina Research Foundation, CMS Region 4","HOME CARE +, a care coordination model for persons receiving home care to prevent hospital, ER and nursing home admission",South Carolina,"2,884,719.00","3,100,611.00","The South Carolina Research Foundation received an award to test a care coordination model for recipients of home care that are nursing home level of care in South Carolina. The project uses a person-centered coaching approach by a Home Care Consultant (nurse) to engage the participant as a team member in their health care decision making.  Through a team approach consisting of their personal care aide who receives a 12 module chronic disease management curriculum and care coordination on a long term basis, this approach will encourage the proper care at the proper time, care continuity, medication adherence, disease management, reduce avoidable hospitalizations, and emergency room visits and increase the length of time to transition to a nursing home.  Over a three-year period, the South Carolina Research Foundation will create an estimated 16 jobs. These workers will include a program manager and home care coordinators.",Initiatives to Accelerate the Development and Testing of New Payment and Service Delivery Models,Ongoing,Health Care Innovation Awards,http://innovation.cms.gov/initiatives/participant/Health-Care-Innovation-Awards/South-Carolina-Research-Foundation.html,42
State of New Hampshire,"State Innovation Models Initiative: Model Design Awards, New Hampshire, NH, long-term care, outcome-based services, care coordination, population health, CMS Region 1",One of sixteen states developing models for multi-payer payment and health care delivery system transformation.,New Hampshire,"1,605,378.00",,,Initiatives to Accelerate the Development and Testing of New Payment and Service Delivery Models,Participants Announced,State Innovation Models Initiative: Model Design Awards Round One,http://innovation.cms.gov/initiatives/participant/State-Innovations-Model-Design/New-Hampshire.html,82
Northland Healthcare Alliance,"Health Care Innovation Awards, HCIA, North Dakota, ND, rural, care coordinators, telemedicine, elderly, hospitalizations, Northland Healthcare Alliance, CMS Region 8",Improving health for the elderly in North Dakota one community at a time,North Dakota,"2,726,216.00","2,966,280.00","Northland Healthcare Alliance received an award to implement a modified version of the Program of All-Inclusive Care for the Elderly (PACE) model in rural North Dakota.  The Alliance will hire and train Community Care Coordinators in seven rural communities who will use a team approach to coordinate the care for the program participants. It will use existing long-term care or assisted living programs and sites to provide coordinated services to the frail elderly. The Northland Care Coordination for Seniors program was developed to keep seniors in the community to live in their home healthier, safer and more independently. The program provides participants, their families, caregivers, and professional health care providers more flexibility to meet health care needs, improve care and the quality of life for those enrolled. The goal of this model is to reduce avoidable admissions to nursing facilities and decrease hospitals stays leading to lower health care costs per person while improving the health and health care for the participants. Over a three-year period, Northland Healthcare Alliance’s program will create an estimated eight jobs that include Community Care Coordinators, Data Analyst and Administrative staff for the Northland Care Coordination for Seniors program.",Initiatives to Accelerate the Development and Testing of New Payment and Service Delivery Models,Ongoing,Health Care Innovation Awards,http://innovation.cms.gov/initiatives/participant/Health-Care-Innovation-Awards/Northland-Healthcare-Alliance.html,44
Delta Dental Plan of South Dakota,"Health Care Innovation Awards, HCIA, North Dakota, ND, South Dakota, SD, oral health, diabetes, reservations, Medicaid, children, preventive care, dental diseases, dental hygienists, community health representatives, surgical care, Delta Dental Plan of South Dakota, CMS Region 8",Improving the care and oral health of American Indian mothers and young children and American Indian people with diabetes on South Dakota reservations,"North Dakota, South Dakota","3,364,528.00","6,200,000.00","Delta Dental of South Dakota, which covers over thirty-thousand isolated, low-income, and underserved Medicaid beneficiaries and other American Indians on reservations throughout South Dakota, received an award to improve oral health and health care for American Indian mothers, their young children, and American Indian people with diabetes. Providing preventive care will help avoid and arrest oral and dental diseases, repair damage, prevent recurrence, and ultimately, reduce the need for surgical care. The project will also work with diabetic program coordinators to identify and treat people with diabetes. By coordinating community-based oral care with other social and care provider services, the model is expected to reduce the high incidence of oral health problems in the area, improve patient access, monitoring, and overall health, and lower cost through prevention with estimated savings of over $6 million. Over the three-year period, the Delta Dental of South Dakota Circle of Smiles program will train an estimated 24 health care workers and create an estimated 24 new jobs. These workers will be comprised of registered dental hygienists and community health representatives who will treat and educate patients and coordinate their dental care.",Initiatives to Accelerate the Development and Testing of New Payment and Service Delivery Models,Ongoing,Health Care Innovation Awards,http://innovation.cms.gov/initiatives/participant/Health-Care-Innovation-Awards/Delta-Dental-Plan-Of-South-Dakota.html,45
FirstVitals Health and Wellness Inc.,"Health Care Innovation Awards, HCIA, Hawaii, HI, low-income, diabetes, care coordination, health information technology, HIT, Medicaid, care coordinators, physicians, medication adherence, ER, hospitalizations, clinical diabetes educator, medical director, FirstVitals Health and Wellness Inc., CMS Region 9",Improving the health and care of low-income diabetics at reduced costs,Hawaii,"3,999,713.00","4,829,955.00","FirstVitals Health and Wellness Inc., in partnership with AlohaCare, received an award to implement and test a care coordination and health information technology plan that will better regulate glucose levels for Medicaid-eligible patients with Type 1 and Type 2 diabetes who have the complication of peripheral neuropathy. FirstVitals will create a secured database that will receive data feeds from a combination of wireless glucose meters and tablets, which are expected to improve health education and social networking around diabetes management issues. The ""real time"" information will be available to integrated care coordinators, patients, physicians and other approved caregivers, informing decisions about care and enabling caregivers to track and monitor glucose levels, improve medication adherence, and increase patient safety and the effectiveness of treatment. The project will reduce foot ulcers and amputations and attendant complications, and reduce emergency room visits and hospitalizations. Over a three-year period, FirstVitals’ program will involve and educate dozens of healthcare workers, train an estimated 11 to 12 healthcare coordinators and will create an estimated 7 to 9 jobs. The new workforce will include integrated care coordinators both clinical and non-clinical, a clinical diabetes educator, and a medical director.",Initiatives to Accelerate the Development and Testing of New Payment and Service Delivery Models,Ongoing,Health Care Innovation Awards,http://innovation.cms.gov/initiatives/participant/Health-Care-Innovation-Awards/Firstvitals-Health-And-Wellness-Inc.html,46
State of Massachusetts,"State Innovation Models Initiative: Model Testing Awards, Massachusetts, MA, primary care, patient-centered medical homes, care coordination, care management, population health management, shared savings, shared risk, public health, CMS Region 1","One of six states implementing, testing and evaluating a multi-payer health system transformation model that aims to deliver high quality care and improve health system performance for its residents. ",Massachusetts,"44,011,924.00",,,Initiatives to Accelerate the Development and Testing of New Payment and Service Delivery Models,Participants Announced,State Innovation Models Initiative: Model Testing Awards Round One,http://innovation.cms.gov/initiatives/participant/State-Innovations-Model-Testing/Massachusetts.html,71
Pacific Business Group on Health,"Health Care Innovation Awards, HCIA, California, CA, Arizona, AZ, Washington, WA, care coordination, rural, urban, Medicare, Medicaid, primary care, care managers, ER, hospitalizations, clinical director, nurses, information technology analysts, Pacific Business Group on Health, CMS Region 9, CMS Region 10",Intensive outpatient care program,"Arizona, California, Washington","19,139,861.00","25,280,570.00","The Pacific Business Group on Health received its award to partner with provider groups in Arizona, California and Washington for the Intensive Outpatient Care Program (IOCP). Care managers embedded in primary care practices provide psychosocial and medical support for 27,000 predicted high-risk patients with chronic illness. The program aims to improve patient experience and clinical outcomes, reduce avoidable emergency room visits and hospitalizations, and spread best practices across a wide network of partners and, ultimately, other providers. Over a three-year period, Pacific Business Group on Health’s program will train over 410 people to spread best practices across a wide network, while creating an estimated 211 jobs for Care Coordinators and project staff. ",Initiatives to Accelerate the Development and Testing of New Payment and Service Delivery Models,Ongoing,Health Care Innovation Awards,http://innovation.cms.gov/initiatives/participant/Health-Care-Innovation-Awards/Pacific-Business-Group-On-Health.html,51
The University of Chicago,"Health Care Innovation Awards, HCIA, Illinois, IL, nurses, social workers, hospitalizations, Medicare, programmer, high-risk populations, The University of Chicago, CMS Region 5",Integrated inpatient/outpatient care for patients at high risk of hospitalization,Illinois,"6,078,073.00","18,750,000.00","The University of Chicago received an award to test a model of care delivery that reasserts the importance of an ongoing doctor-patient relationship. The project will use multidisciplinary teams—including Registered Nurses, Licensed Practical Nurses, social workers, and medical assistants led by Comprehensive Care Physicians (CCPs)—to provide consistent care to Medicare beneficiaries before, during, and after hospitalizations. CCPs will perform rounds in hospitals 48 weeks per year, ensuring they see patients and monitor their health consistently. The targeted population will include beneficiaries with a high probability of hospitalization, making it more likely that CCPs will encounter their patients during rounds in the hospital. Over a three-year period, The University of Chicago program will train an estimated 26 workers and will create an estimated 11 jobs. The new workforce will include a programmer, 4 research assistants, 5 comprehensive care physicians, 2 nurses, a social worker and a medical office assistant.",Initiatives to Accelerate the Development and Testing of New Payment and Service Delivery Models,Ongoing,Health Care Innovation Awards,http://innovation.cms.gov/initiatives/participant/Health-Care-Innovation-Awards/The-University-Of-chicago.html,47
